month,date,title,url,civ_count,civ_per_1000,matched_sentences
2024-10,2024-10-08,"Greetings to the International Research and Practical Conference Altai Mountains, the Birthplace of Turkic Nations: On the Origins of Turkic Civilisation • President of Russia",http://en.kremlin.ru/events/president/news/75285,1,3.90625,"I would like to emphasise that the languages and traditions of Turkic peoples, as well as their distinctive way of life, are an essential part of Russia’s historical heritage as a unique civilisational state."
2023-08,2023-08-22,Video address on National Flag Day • President of Russia,http://en.kremlin.ru/events/president/news/72081,1,3.7593984962406015,Russia is a one thousand year old country and civilization.
2023-08,2023-08-23,Meeting with Acting Governor of Zaporozhye Region Yevgeny Balitsky • President of Russia,http://en.kremlin.ru/events/president/news/72088,1,0.5235602094240839,"I heard your speech in Beijing on May 14, 2017, and you said something like “greater Russia is not an abstract geopolitical concept, but a civilisational project aimed at the future.” And you know, even then, in 2017, I took in the tone of your words."
2023-04,2023-04-12,"Briefing by Foreign Ministry Spokeswoman Maria Zakharova, Moscow, April 12, 2023 - The Ministry of Foreign Affairs of the Russian Federation",https://mid.ru/en/press_service/spokesman/briefings/1863130/,3,0.1663155560483424,"New opportunities will open up for trade, economic and investment cooperation, for facilitating transport, infrastructure and logistics interdependence, for implementing energy, agricultural and telecommunications projects and those in other spheres of mutual interest, for advancing inter-civilisational dialogue and for intensifying cultural and humanitarian ties, primarily in culture, education, science and technology. || The focus on cultural and humanitarian aspects helps promote active inter-civilisational dialogue, strengthen contacts between the peoples of the SCO member states, and forge mutual understanding, friendship and trust in the region. || Maria Zakharova: We advocate a more equitable and democratic international order that will promote reliable security, the preservation of unique cultural-civilisational identity and equal opportunities for the development of all states."
2023-04,2023-04-16,Meeting with Chinese Minister of National Defence Li Shangfu • President of Russia,http://en.kremlin.ru/events/president/news/70941,1,1.215066828675577,"Mr Xi Jinping has advanced several major initiatives, including a civilisational initiative that has to do with global development."
2022-06,2022-06-30,Address to participants of 10th St Petersburg International Legal Forum • President of Russia,http://en.kremlin.ru/events/president/news/68785,1,1.1160714285714286,"With this approach, we could avoid crises such as the current one in Donbass that is happening to protect its residents from genocide – and there can be no other definition for the Kiev regime’s actions than “a crime against humanity.” At the same time, Russia will continue to create a more democratic and just world where the rights of all peoples are guaranteed and mankind’s cultural and civilizational diversity is preserved."
2023-12,2023-12-18,Video address to participants in CIS Heads of Government Council meeting • President of Russia,http://en.kremlin.ru/events/president/news/73014,1,1.1325028312570782,"I believe you will agree that we have inherited a truly unique civilisational blend of traditions and customs, languages and literature, art and folk culture."
